{
  "$schema": "./_schema.json",
  "id": "clothing-footwear",
  "slug": "odeca-i-obuca",
  "level": 1,
  "sort_order": 1,
  "icon": "üëï",
  "names": {
    "sr": "Odeƒáa i obuƒáa",
    "en": "Clothing & Footwear",
    "ru": "–û–¥–µ–∂–¥–∞ –∏ –æ–±—É–≤—å"
  },
  "descriptions": {
    "sr": "Mu≈°ka, ≈æenska i deƒçja odeƒáa, obuƒáa i modni dodaci",
    "en": "Men's, women's and children's clothing, footwear and fashion accessories",
    "ru": "–ú—É–∂—Å–∫–∞—è, –∂–µ–Ω—Å–∫–∞—è –∏ –¥–µ—Ç—Å–∫–∞—è –æ–¥–µ–∂–¥–∞, –æ–±—É–≤—å –∏ –º–æ–¥–Ω—ã–µ –∞–∫—Å–µ—Å—Å—É–∞—Ä—ã"
  },
  "seo": {
    "sr": {
      "title": "Odeƒáa i obuƒáa | Vondi Marketplace",
      "description": "Kupite odeƒáu i obuƒáu online. ≈†irok izbor mu≈°ke, ≈æenske i deƒçje odeƒáe.",
      "keywords": "odeƒáa, obuƒáa, garderoba, moda"
    },
    "en": {
      "title": "Clothing & Footwear | Vondi Marketplace",
      "description": "Buy clothing and footwear online. Wide selection of men's, women's and children's clothing.",
      "keywords": "clothing, footwear, fashion, wardrobe"
    },
    "ru": {
      "title": "–û–¥–µ–∂–¥–∞ –∏ –æ–±—É–≤—å | Vondi Marketplace",
      "description": "–ö—É–ø–∏—Ç—å –æ–¥–µ–∂–¥—É –∏ –æ–±—É–≤—å –æ–Ω–ª–∞–π–Ω. –ë–æ–ª—å—à–æ–π –≤—ã–±–æ—Ä –º—É–∂—Å–∫–æ–π, –∂–µ–Ω—Å–∫–æ–π –∏ –¥–µ—Ç—Å–∫–æ–π –æ–¥–µ–∂–¥—ã.",
      "keywords": "–æ–¥–µ–∂–¥–∞, –æ–±—É–≤—å, –º–æ–¥–∞, –≥–∞—Ä–¥–µ—Ä–æ–±"
    }
  },
  "google_category_id": 166,
  "children": [
    {
      "id": "womens-clothing",
      "slug": "zenska-odeca",
      "parent_slug": "odeca-i-obuca",
      "level": 2,
      "sort_order": 1,
      "names": {
        "sr": "≈Ωenska odeƒáa",
        "en": "Women's Clothing",
        "ru": "–ñ–µ–Ω—Å–∫–∞—è –æ–¥–µ–∂–¥–∞"
      },
      "descriptions": {
        "sr": "Haljine, majice, pantalone, suknje i sva ≈æenska garderoba",
        "en": "Dresses, tops, pants, skirts and all women's wardrobe",
        "ru": "–ü–ª–∞—Ç—å—è, —Ç–æ–ø—ã, –±—Ä—é–∫–∏, —é–±–∫–∏ –∏ –≤—Å—è –∂–µ–Ω—Å–∫–∞—è –æ–¥–µ–∂–¥–∞"
      },
      "google_category_id": 1604,
      "children": [
        {
          "id": "womens-dresses",
          "slug": "haljine",
          "parent_slug": "zenska-odeca",
          "level": 3,
          "sort_order": 1,
          "names": {
            "sr": "Haljine",
            "en": "Dresses",
            "ru": "–ü–ª–∞—Ç—å—è"
          },
          "google_category_id": 2271
        },
        {
          "id": "womens-tops",
          "slug": "zenske-majice-i-topovi",
          "parent_slug": "zenska-odeca",
          "level": 3,
          "sort_order": 2,
          "names": {
            "sr": "Majice i topovi",
            "en": "Tops & T-shirts",
            "ru": "–¢–æ–ø—ã –∏ —Ñ—É—Ç–±–æ–ª–∫–∏"
          },
          "google_category_id": 212
        },
        {
          "id": "womens-pants",
          "slug": "zenske-pantalone",
          "parent_slug": "zenska-odeca",
          "level": 3,
          "sort_order": 3,
          "names": {
            "sr": "Pantalone",
            "en": "Pants",
            "ru": "–ë—Ä—é–∫–∏"
          },
          "google_category_id": 204
        },
        {
          "id": "womens-jeans",
          "slug": "zenske-farmerke",
          "parent_slug": "zenska-odeca",
          "level": 3,
          "sort_order": 4,
          "names": {
            "sr": "Farmerke",
            "en": "Jeans",
            "ru": "–î–∂–∏–Ω—Å—ã"
          },
          "google_category_id": 214
        },
        {
          "id": "womens-skirts",
          "slug": "suknje",
          "parent_slug": "zenska-odeca",
          "level": 3,
          "sort_order": 5,
          "names": {
            "sr": "Suknje",
            "en": "Skirts",
            "ru": "–Æ–±–∫–∏"
          },
          "google_category_id": 2580
        }
      ]
    },
    {
      "id": "mens-clothing",
      "slug": "muska-odeca",
      "parent_slug": "odeca-i-obuca",
      "level": 2,
      "sort_order": 2,
      "names": {
        "sr": "Mu≈°ka odeƒáa",
        "en": "Men's Clothing",
        "ru": "–ú—É–∂—Å–∫–∞—è –æ–¥–µ–∂–¥–∞"
      },
      "descriptions": {
        "sr": "Ko≈°ulje, majice, pantalone i sva mu≈°ka garderoba",
        "en": "Shirts, t-shirts, pants and all men's wardrobe",
        "ru": "–†—É–±–∞—à–∫–∏, —Ñ—É—Ç–±–æ–ª–∫–∏, –±—Ä—é–∫–∏ –∏ –≤—Å—è –º—É–∂—Å–∫–∞—è –æ–¥–µ–∂–¥–∞"
      },
      "google_category_id": 1604,
      "children": [
        {
          "id": "mens-tshirts",
          "slug": "muske-majice",
          "parent_slug": "muska-odeca",
          "level": 3,
          "sort_order": 1,
          "names": {
            "sr": "Majice",
            "en": "T-shirts",
            "ru": "–§—É—Ç–±–æ–ª–∫–∏"
          },
          "google_category_id": 212
        },
        {
          "id": "mens-shirts",
          "slug": "muske-kosulje",
          "parent_slug": "muska-odeca",
          "level": 3,
          "sort_order": 2,
          "names": {
            "sr": "Ko≈°ulje",
            "en": "Shirts",
            "ru": "–†—É–±–∞—à–∫–∏"
          },
          "google_category_id": 207
        },
        {
          "id": "mens-pants",
          "slug": "muske-pantalone",
          "parent_slug": "muska-odeca",
          "level": 3,
          "sort_order": 3,
          "names": {
            "sr": "Pantalone",
            "en": "Pants",
            "ru": "–ë—Ä—é–∫–∏"
          },
          "google_category_id": 204
        }
      ]
    },
    {
      "id": "kids-clothing",
      "slug": "decija-odeca",
      "parent_slug": "odeca-i-obuca",
      "level": 2,
      "sort_order": 3,
      "names": {
        "sr": "Deƒçija odeƒáa",
        "en": "Kids' Clothing",
        "ru": "–î–µ—Ç—Å–∫–∞—è –æ–¥–µ–∂–¥–∞"
      },
      "descriptions": {
        "sr": "Odeƒáa za devojƒçice, deƒçake i bebe",
        "en": "Clothing for girls, boys and babies",
        "ru": "–û–¥–µ–∂–¥–∞ –¥–ª—è –¥–µ–≤–æ—á–µ–∫, –º–∞–ª—å—á–∏–∫–æ–≤ –∏ –º–∞–ª—ã—à–µ–π"
      },
      "children": [
        {
          "id": "girls-clothing",
          "slug": "za-devojcice",
          "parent_slug": "decija-odeca",
          "level": 3,
          "sort_order": 1,
          "names": {
            "sr": "Za devojƒçice",
            "en": "Girls' Clothing",
            "ru": "–î–ª—è –¥–µ–≤–æ—á–µ–∫"
          }
        },
        {
          "id": "boys-clothing",
          "slug": "za-decake",
          "parent_slug": "decija-odeca",
          "level": 3,
          "sort_order": 2,
          "names": {
            "sr": "Za deƒçake",
            "en": "Boys' Clothing",
            "ru": "–î–ª—è –º–∞–ª—å—á–∏–∫–æ–≤"
          }
        }
      ]
    },
    {
      "id": "womens-footwear",
      "slug": "zenska-obuca",
      "parent_slug": "odeca-i-obuca",
      "level": 2,
      "sort_order": 4,
      "names": {
        "sr": "≈Ωenska obuƒáa",
        "en": "Women's Footwear",
        "ru": "–ñ–µ–Ω—Å–∫–∞—è –æ–±—É–≤—å"
      },
      "children": [
        {
          "id": "womens-heels",
          "slug": "cipele-na-stiklu",
          "parent_slug": "zenska-obuca",
          "level": 3,
          "sort_order": 1,
          "names": {
            "sr": "Cipele na ≈°tiklu",
            "en": "Heels",
            "ru": "–¢—É—Ñ–ª–∏ –Ω–∞ –∫–∞–±–ª—É–∫–µ"
          }
        },
        {
          "id": "womens-sneakers",
          "slug": "zenske-patike",
          "parent_slug": "zenska-obuca",
          "level": 3,
          "sort_order": 2,
          "names": {
            "sr": "Patike",
            "en": "Sneakers",
            "ru": "–ö—Ä–æ—Å—Å–æ–≤–∫–∏"
          }
        }
      ]
    },
    {
      "id": "mens-footwear",
      "slug": "muska-obuca",
      "parent_slug": "odeca-i-obuca",
      "level": 2,
      "sort_order": 5,
      "names": {
        "sr": "Mu≈°ka obuƒáa",
        "en": "Men's Footwear",
        "ru": "–ú—É–∂—Å–∫–∞—è –æ–±—É–≤—å"
      },
      "children": [
        {
          "id": "mens-sneakers",
          "slug": "muske-patike",
          "parent_slug": "muska-obuca",
          "level": 3,
          "sort_order": 1,
          "names": {
            "sr": "Patike",
            "en": "Sneakers",
            "ru": "–ö—Ä–æ—Å—Å–æ–≤–∫–∏"
          }
        },
        {
          "id": "mens-formal-shoes",
          "slug": "elegantne-cipele",
          "parent_slug": "muska-obuca",
          "level": 3,
          "sort_order": 2,
          "names": {
            "sr": "Elegantne cipele",
            "en": "Formal Shoes",
            "ru": "–ö–ª–∞—Å—Å–∏—á–µ—Å–∫–∞—è –æ–±—É–≤—å"
          }
        }
      ]
    }
  ]
}
